Anisa Fitry,1,2021-12-10 6:49:00,"Parah sih beli paket internet 2x, yang satu hilang.. nanya sama agent live chat gak efisien, berjam jam dan gak dapet jawaban yang memuaskan.. Padahal baru mau coba pake XL, tapi langsung dapet kecewa..",1,1,1,-1,
vina oktaviani,1,2021-12-10 6:44:00,"bagaimana ini xl saya beli paket dari aplikasi myxl sudah memotong gopay saya dan berhasil dari laporan gopay nya tapi paket data nya tidak masuk masuk, dan sekarang malah ga bisa masuk k aplikasi myxl nya untuk komplen..",1,1,1,-1,
Rusmayadi Mahrim,1,2021-12-10 6:37:00,Wah paraaaaah XL. Sdah pulsa terpotong via gopay tapi kuota gak kunjung datang ditunggu dari pagi sampai sore belum masuk. Bahkan di app gak ada tempat mencari info pemberitahuan sukses. Paraaah....banget. kasihan yg nunggu. Bagaimana ini chat Maya juga jawab gak nyambung. Nunggu cs tapi antrian 191. Paraaaaaaaah,1,1,1,-1,
Benny Ka,1,2021-12-10 5:29:00,Sudah beli paket internet dari pagi tadi dan transaksi berhasil. Tapi paket tidak kunjung terdaftar. Padahal sudah tersedot dana nya. Ini gimana sih?,1,1,1,-1,
Hilman A,3,2021-12-10 4:19:00,"Sistem unlimited nya udah gak kayak dulu, apalagi signal nya sekarang lemot parah. #UDAHGAKKAYAKDULU. 5 hp dikeluargaku pakai XL. Sorry min admin ðŸ™ ini bentuk loyal konsumen ___ asvv",1,1,1,-1,
JOKO PURNANING WOKO,1,2021-12-10 3:40:00,"KECEWA BANGET!!!!! signal 4g, 3 bar sampe 4 bar, paket internet baru beli gak bisa buat apa2, sekedar kirim pesan WA aja susahnya minta ampun... Kalo kayak gini terus mending pindah provider aja",1,1,1,-1,
Faisal Alhaddad,5,2021-12-10 1:52:00,"Kenapa aplikasi myXL saya tidak bisa dibuka? Setiap saya masuk aplikasi myXL selalu ada tulisan aplikasi tidak menanggapi, anda ingin menutupnya Kenapa selalu begitu padahal saya sangat membutuhkan aplikasi ini untuk saya mengecek paket data dan pulsa, customer service xl tolong solusinya",3,3,3,0,
Fajar Flava,3,2021-12-10 1:25:00,"XL sy akui sinyal nya bagus bgt, , tp hanya saja boros nya mnta ampun, 20 gb cm brthan 2 mggu, Beda sm simcard yg ke 2 tsel sya, sm2 20gb tp cukup sebulan,,, pdhal pemakaian sama, tp XL lbih boros,",1,1,1,-1,
zahra humairo,1,2021-12-10 1:13:00,"Makin lama makin nggak jelas xl. Masa iya sinyal tiba2 ilang terus nggak balik lagi. Udah dimode pesawatin , hp udah direstart tapi masih juga nggak ada. Yg bener dikit lah xl. Becandanya kelewatan",1,1,1,-1,
ZONA AMAN,1,2021-12-10 18:07:00,"Kenapa kartu saya disabotase kenapa woy, apa karena saya sering memarahi cs atau gmna, padahal tetangga Sawa signal Wifi-nya pakai provider XL, dan selalu penuh, giliran kita yg pakai signal hp mlah sprti ini, tolong lah pihak XL jangan sprti ini trus, sya males lah kalau mau pindah2 provider lain, nanti harus login ulang datanya,",1,1,1,-1,
Kopana didik harianto,1,2021-12-10 16:55:00,"Malam .. pak ini aplikasinya yg berat apa hp saya yg jelek ... mohon diperbaiki aplikasinya .. karna saya buka diaplikasi provider lainnya itu bisa kecuali xl .. kode verifikasi masuknya juga lama .. lebih dri 5 menit .. lalu sms masuk tumpang tindih .. registrasi jadinya error .. #mau daftar paket saja susahnya minta ampun .. mohon jgn info clear cache, memori penuh, instal ulang.. * daftar paketan via sms juga gitu dialihkan ke myxl.. mohon dipermudah yg via sms .. terima kasih..",3,3,3,0,
Rengga BM,1,2021-12-10 15:41:00,"Saya masuk dipusat bantuan untuk menanyakan perihal gagal masuk acount MYXL saya,hanya dijawab pake template,nggak ada solusi yang harus dilakukan.capek2 saja saya menunggu.",1,1,1,-1,
ambon jylo,2,2021-12-10 15:32:00,"Ini gimana sih cara aktif.n kuota unlimited youtube.a? Nih kenapa klo mau aktif.n kuota unlimited gk bisa ya, keluar* terus? Tolong diperbaiki lagi pelayanan.a, terima kasih",3,3,3,0,
_shintyaa 14,1,2021-12-10 14:30:00,"Udah jadi favorit nih XL paketnya murah unlimited enak bgt, tapi kecewa skrg sinyalnya jelek bgt. Padahal baru aja isi paketan malah tambah lemot. Tolong dong kalo bisa perbaiki! Udah bingung bgt harus pake kartu apalagiðŸ˜”.................................................................",3,3,3,0,
Ary Ajus,1,2021-12-10 11:23:00,"Sinyalnya tidak sampai ke pedesaan . Di kampung tempat saya tinggal masih sulit sinyalnya apalagi jaringan datanya . Mohon bagi pihak xl , agar bisa memperbaiki kualitas jaringannya",3,3,3,0,
Mathers Ellen,4,2021-12-10 10:52:00,"XL sekarang ndak jelas, isi kuota belum masuk masuk, masalah sebelum nya pernah lapor di CS juga belum terselesaikan sampai 1 minggu an, berharap terselesaikan semua problem sy dalam waktu dekat dah",1,1,1,-1,
Dedi Setiawan,5,2021-12-09 5:00:00,"Terimakasih xl telah menemani kegiatan sehari hari saya selama 3 tahun ini, Tapi kayak nya saya mau ganti kartu aja. Soal nya harga kuota xl mahal mahal. Masa saya sebulan isi ulang kuota xl habis 300 ribu. Dari tgl 1 saya isi ulang 40k dpt 10 gb yg cuman dapet kuota UTAMA 7,5gb sisa nya kuota MALAM. Ya kali gw begadang tengah malam jam 1 sampe jam 6 subuh cuman buat gunain kuota malam. padahal dulu taun 2019/2018 xl gak begini dulu harga 40k dpt 8GB kuota utama tanpa di bagi kuota malam.",1,1,1,-1,
Indra Hadi,1,2021-12-09 17:14:00,"Ini aplikasi yg gk jelas x. Gk bisa2 dibuka utk cek paket & kuota. Aplikasi amatiran, padahal perusahaannya udah lama, mana sinyalnya lemot lg. Gk mau kasih bintang lg",1,1,1,-1,
Player Noob,1,2021-12-09 17:08:00,"Saya sangat kecewa dengan layanan internet xl, sayang pengguna xl sudah hampir 3 tahun walaupun kartunya ganti2, dan setiap akhir tahun selalu jaringannya tidak pernah bagus, ini tahun ke 3 saya make xl, bahkan saya tinggal berdekatan dengan towernya. MOHON TAHUN DEPAN DI BAGUSIN LAYANAN INTERNETNYA",1,1,1,-1,
Ade Ridwan,3,2021-12-09 16:15:00,"Sekarang masa aktif nya sebentar, tibaÂ² sudah ada pemberitahuan kalau kartunya sudah masa tenggang, dan signal suka tidak stabil, apabila buat game suka ngeleg, sinyal penuh tapi tetap internet nya suka macet",1,1,1,-1,
pak pely,5,2021-12-09 15:29:00,Apk ya bagus !!!!!!!!!! gua baru tau di apk ini bisa to up game ff !!!! murah di codasop to up diamon pakai pulsa 140dm 25k di apk ini cuma 19k semoga apdate nati kita bisa beli mebersip mingguan /bulanan top lah jadi kepingin beli pulsa sering sering buat to up dm murahhhhhh :) jagan beli kartu sem**fren ajg lemod to up jga mahal salam dari peleyer ff :)gua saranin mode to up di tengah apk di apdate nanti :) saran: bisa beli kode goole play :),2,2,2,1,
28_sefira Intan Oktavioni 8H,1,2021-12-09 0:44:00,Kenapa saya mau buka aplikasi my xl selalu gak bisa katanya aplikasi tidak menanggapi selalu aja begitu kalau mau buka my xl tolong diperbaiki dong !!!!!!! Dan tolong dijawab juga!!!!!!!,1,1,1,-1,
e12kp EKO,1,2021-12-08 6:22:00,"Tolong diperbaiki apknya. Susah kebuka dan selalu keluar sendiri apknya. Sudah dilakuakan restrat dan hapus apk kemudian di download lagi. Tetap saja masih sama seperti awal. XL perusahaan Proveder besar, masa apk sendiri seperti apk odong2. Payaaaaah.",1,1,1,-1,
Yuli Yuli,3,2021-12-08 23:00:00,"tidak terlalu baguss apk sering error,minta update terus2an dan pulsa sy suka habis sendiri gak jelas padahal sy gak pake pulsa hari ini isi pulsa 5 ribu tiba2 aja besok atau lusa pulsa nya berkurang dan tersisa 2 ribu padahal gak buat di pake apa2 kesel",1,1,1,-1,
Fidyastya,1,2021-12-08 1:49:00,"Kecewa sama XL, beli paketan lewat myXL udah dibayar btapi kuota tidak ada masuk, udah ditunggu beberapa jam juga tidak masuk. Akhirnya beli ulang lagi. Kecewa sih jadinya rugi karena kuota tidak masuk padahal udah dibayar",1,1,1,-1,
Muhammad Wahyudin,1,2021-12-08 17:37:00,"Sangat pantas saya berikan bintang 1, karena tidak ada perbaikan jaringan diDuri Kosambi Jakarta Barat, coba dicek ada gedung apa yg menghalangi tower jaringan XL, sebelum gedung-gedung itu berdiri sangat bagus sinyalnya. Percuma chat bot maya tidak ada solusi, customer care terkendala terputus berulang kali, tidak perlu balas ke email saya, perbaiki saja jaringannya.",1,1,1,-1,
bang pul,3,2021-12-08 15:53:00,"Mau tanya tolong bisa dijawab,knp sekarang setiap beli pulsa masa aktif kartu tidak otomatis diperpanjang??? Dan harus beli masa aktif Ditunggu jawabannya",3,3,3,0,
Sukri Vespa,1,2021-12-08 12:54:00,Udah lama gak make xl. Pindah ke lain karna jaringannya yg gak bagus. Balik ke xl karna ada kuata kuhusus game. Eh ternyata malah tambah jelek jaringanya. Tinggal di kota aja begini jaringannya gimna kalo di pelosok desa ya... Ini Marketing yg sangat bagus. Supaya banyak pengguna xl. Tapi tetap di hujat sama orang lain. Jualan lah dengan jujur supaya konsumenmu tidak kecewa. #udahgituaja,1,1,1,-1,
Priyanto Yanto,2,2021-12-08 12:26:00,"kpd. Developer terhormat di tempat Hallo saya pengguna baru aplikasi ini, sedikit saran dari saya. Tolong segera diperbaiki masih banyak kekurangan. Pas masuk app lelet banget,terus suka keluar sendiri. Saya pikir ini bukan masalah jaringan atau masalah pada hp nya tapi masalah pada aplikasinya. sekian dan terima kasih.",3,3,3,0,
Adetaesa Diyan Degananda,1,2021-12-08 10:05:00,"Saya nyoba xl ternyata mengecewakan. Bayangkan setiap 10-15mnit dapat sms pulsa anda habis intinya dsuru ngisi dah,sedangkan tidak butuh pulsa biasa. Itu jatuhnya SPAM. Mengganggu sangat. Andai ada rating minus",1,1,1,-1,
Rome Sbastian,1,2021-12-07 6:59:00,"Baru download apk myXL, ada keterangan gagal memuat data. Dan saya coba klik xl store tidak ada gambar/maupun tulisan. Padahal ram8gb dan internal 256gb. Saya kecewa. Auto tidak jadi pakai kartu xl",1,1,1,-1,
Ganar Dito,1,2021-12-07 4:56:00,"Kecewa dengan aplikasi My XL,loadingnya lambat banget dan suka crash aplikasinya tidak lancar.Mohon pihak XL segera memperbaiki sistem aplikasi My XL agar pelanggan bisa menggunakannya dengan nyaman dan tidak terhambat.Terimakasih",1,1,1,-1,
papa dinda,1,2021-12-07 2:16:00,"XL NETWORK PAYAH !! PAKET DATA SAYA BELI BOS!! NGGA NGUTANG, NGGA KREDIT, NGGA MINTA!! TAPI KUALITAS JARINGAN NYA SEOLAH SAYA NGEMIS SINYAL!! SEMUA PENCAPAIAN DI GAME RUSAK CUMA KARENA SINYAL JELEK!!! SEMUA TAHAP DAN PROSES PEMAKSIMALAN GADGET SUDAH DILAKUKAN , TETAP SAJA JARINGAN MACAM NGEMIS !!! KALAU SUDAH NGGA SANGGUP LAYANI PELANGGAN, MERGER ATAU TUTUP AJA BOS. NGECEWAIN TERUS BISANYA. ANDAI ADA RATING BINTANG 1/4 SAYA KASIH 1/4 BINTANG!! MAAF DAN TERIMA KASIH!",1,1,1,-1,
al Jauziy,4,2021-12-07 13:48:00,Mantap sih lumayan.... Cuman klo buat main game di area sini sinyalnya suka ngprank.... Pas di beranda warna ijo.... Cuman pas udah mulai main gamenya tiba2 turun drastis... Saya mohon buat makin perbaikin lagi deh.... Ping nya.... Terimakasih.....,3,3,3,0,
Agus Pande,1,2021-12-07 12:44:00,"gua milih kartu xl karena murah meski kualitasnya sangat rendah,, memkry gua kosong, chase udah di hapus, kenapa selalu kalo mau beli paketan gak bisa tiba tiba ke potong pulsanya? suka gak bisa di buka alasan sedang perbaikan masa setiap hari perbaikan?? hahh mau ngomong apa lagi lu?? memory internal?? chase?? dari dulu kek gini gak guna",1,1,1,-1,
ady tm,1,2021-12-07 12:22:00,"Aplikasi nya terlalu berat sehingga sulit dibuka, dan sangat sering error, apakah tidak bisa dibuat lebih sederhana aplikasinya agar lebih mudah di akses. TOLONG PERHATIAN NYA BUAT ADMIN. SUDAH BEBERAPA TAHUN SAYA MENGGUNAKAN APLIKASI INI DENGAN BERBAGAI TYPE SMARTPHONE TETAP SAJA SAMA, BERAT SAAT DIBUKA DAN SERING ERROR, TOLONG DI PERBAIKI JANGAN CUMA UPGRADE TANPA MEMPERBAIKI.",1,1,1,-1,
Abdul Rahmat,1,2021-12-07 12:18:00,"App myXl error atau lagi rusak kah, akubudh coba chat service malah dijawab abak abal, kan bingung, katanya ada pemberitahuan kakau dha berhasil login, udh ad, kuikutin saran di internet juga bekum bisa, ini app myXl knp??",1,1,1,-1,
Wanda Apriliana,1,2021-12-07 11:54:00,Sinyal bagus kuota banyak tapi setiap mau buka my XL tulisanya coba lagi dan katanya ga ada koneksi internet. Makin kesini XL makin ga jelas banget. Tolong pihak developer diperbaiki lagi apknya,3,3,3,0,
Andi Liana,5,2021-12-07 11:27:00,"Tog diperbaiki lg , pas masuk aplikasinya msh suka lemot padahal jaringan lumer ,, sering bgt terjadi kesalahan/erorr koneksi , saya sudah jadi langganan XL dari tahun 2009 pertama saya punya handphone , , suksea selalu",3,3,3,0,
Muhammad Taufik,1,2021-12-07 0:09:00,"Sudah 1bulan lebih aplikasi error mulu. Tiap mau isi kouta tetep ""terjadi kesalahan"" Mau bayar pakai apapun tetep sama. Mohon dperbaiki. Aplikasi dperbuat untuk mempermudah pelanggan.",1,1,1,-1,
Mhmmd Zal,1,2021-12-06 7:50:00,"Koneksi jaringan gagal, sedang menunggu proses perbaikan tapi udah 6 bulan belum di perbaiki,, apakah pelayanan XL memang begini? Udah ngadu di call center tapi di suruh restar handpone, padahal sudah semuanya, cuman belum ku banting",1,1,1,-1,
Muh Fathin,3,2021-12-06 7:49:00,Ada apa dengan XL ko lag mulu udh 4 hari lag XL udh gak kayak dulu bagus sekarang lag mulu padahal kuota gue masih ada 5 gb mohon kpd pihak XL tolong perbaiki lagi jaringan nya kalau udh bagus aku kasih bintang 5 sekian terimakasih,1,1,1,-1,
Rilex Band,5,2021-12-06 7:44:00,Sy pelanggan XL ..tp tidak tahu jumlah point yg sy miliki ..sy pikir saat pembelian paket secara otomatis point masuk ..kakau mesti klik sana sini gk praktis jd nya ..XL Ku ini ..,3,3,3,0,
MHassanal Bolkiah,1,2021-12-06 7:02:00,"Kenapa XL tidak mengadakan call center kaya dlu, knpa sekarang jika ada problem harus pakai live chat, sedangkan live chat kurang tepat untuk mengatakan permasalahan.. Ditambah amat sangat lama menjawab chat customer nya,",3,3,3,0,
Akbar Ardi,4,2021-12-06 7:00:00,Sejauh ini aplikasinya bagus.Tolong untuk performa dari aplikasi ini harus ditingkatkan lagi dan tambahkan fitur hapus notifikasi karena dapat menurunkan performa aplikasi ini. Sekian Terima kasih,2,2,2,1,
Anna Cece,1,2021-12-06 6:49:00,"Jaringan buruk. Aplikasi gabisa di buka! Berulang kali begitu terus! Sudah hapus cache/data, unin sampe instal ulng& restart hp tetep kgk bisa dibuka! Nyesel gue isi pulsa, tapi gabisa dipaketin! Udh gitu mahal paketannya jika beli non via aplikasi! Auto uninstal! Selamat tinggal",1,1,1,-1,
Ummi gAlaNg,5,2021-12-06 5:42:00,"Udah agak bagus, cuma disayangkan tower XL di kepulauan nias sangat sangat terbatas. Hanya beberapa titik. Seandainya bisa ada di tiap kecamatan seperti provider sebelah, yakin mereka akan pindah ke XL. bisa dihitung dg jari XL di kepulauan nias",2,2,2,1,
haidar raabih,1,2021-12-06 2:53:00,"Kenapa ya pulsa saya kesedot terus, untuk pemakaian internet, padahal paketan internet saya pakai provider lain... Saya punya kartu XL sudah sejak tahun 2003, sehingga para teman dan juga klien saya ngerti ya nomer XL tsb, paling2 ya dipakai tlp2 saja dan gak di pakai internetan, xl axiata, kembalikan pulsa saya",1,1,1,-1,
Ann,1,2021-12-06 2:50:00,"Pelayanan virtual chatnya minus, lelet, tidak membantu sama sekali. Kayanya semua call centre nya dikasih nama samaran MAYA. Gimana mau kasih bintang 5 kalau pelayanannya buruk begini. Buat apa jd nasabah xl prioritas kalau pelayanan nya ga layak disebut dgn prioritas.",1,1,1,-1,
Agung Syaifudin,3,2021-12-06 1:34:00,"Gampang eror...dr td beli pulsa tidak masuk""..padahal LG urgent banget,pusat bantuan nya juga tidak berfungsi.. untuk apa ada pusat bantuan klo TDK bisa mengatasi masalah",1,1,1,-1,
Muhammad Rizqi Aprilia,1,2021-12-06 1:10:00,"Jelek bet jaringan nya bikin toxic terus kalau lagi nge game sangat ampas bet sumpah dah ga pernah di benerin apa kali yak padahal juga bbyak yg komplen hadehh JARINGAN NYA 0/10 ALIAS AMPAS, dan satu lagi aplikasi XL nya juga suka nge bug ga jelas kadang ga bisa di buka dan juga ga ada opsi buat beli paket yang biasa sya beli",1,1,1,-1,
Aldan Sunarya,1,2021-12-06 16:14:00,"Mohon maaf pak/bu, to the point, kenapa kinerja xl kian hari kian menurun? Semoga xl bisa mengembalikan kenyamanan para pengguna xl seperti dulu lagi.",3,3,3,0,
Arif Munandar,3,2021-12-06 15:52:00,Sinyal kurang stabil.. Mohon di perbaiki jangkauan wilayah sinyal... Agar lebih baik.. Dan bisa di nikmati berbagai wilayah. Dan perluas jaringan agar banyak lagi pengguna xl. ðŸ™,3,3,3,0,
Pak Dee,1,2021-12-06 14:38:00,"Saya ke sini mau komplain, kenapa saya perpanjang paketan, jadi Lemot/kecepatan per mb di batasi, tidak bisa buat main Game/Nonton YouTube, muter muter terus",1,1,1,-1,
Arif Jack,1,2021-12-06 14:22:00,"maaf saya mau tanya, my xl saya kenapa iyaa saya mau paketin data di my xl tapi gak bisa"" iyaa ?? padahal saya sudah restart dan bersihkan aplikasi dan dwonload ulang my xl tapi tetap tidak bisa buat paketiin data di my xl... tolong di bantu",3,3,3,0,
cik aan mad,1,2021-12-06 11:30:00,"lucu xl ini jaringan nya, 4G+ signal penuh, kuota ku ada 10GB, tapi sudah sebulan ini, di handphone tidak ada koneksi, ganti ke indosat, okey banget lancar, artinya handphone ku nggak ada masalah, yg bermasalah jaringan XL, bisnis rugi garaÂ² pakai jaringan XL",1,1,1,-1,
joe ank,1,2021-12-05 8:47:00,"Sudah 3 bulan ini ga bisa buka apk myxl. Sudah sering buat ulasan balasannya cuma hub maya, clear cache. Itu2 trs sangat ga membantu mau Dicoba 100x pun tetap ga bisa. ðŸ˜ˆðŸ˜ˆðŸ˜ˆ",1,1,1,-1,
Edy Rosiandi,1,2021-12-05 8:42:00,Mengapa bonus selalu melalui myxl app kenapa gak langsung otomatis gue udah lama pakai XL sampai berapa kali ganti no selalu pakai XL ...tapi sekarang gue jadi kecewa ....jadi untuk internet gu stop pakai XL ...sinyal selalu lemot .... tower dimana mana di kuasai XL ....percuma banyak tower tapi sinyalnya minus ...bahkan di tengah kota besar pun sinyalnya minta ampun lemotnya apa lagi di daerah pelosok ....,1,1,1,-1,
Nafitz Chanel,1,2021-12-05 4:04:00,"Haduh pusing deh di bikin jaringan xl , Tiba tiba setiap siang hari mati muluuu ,. Kalo mati nya sebentar mah gak apa apa ini malah mau setengah hari kaga nyala nyala , Pokok ny ga puasss , Belik paket mahal mahal",1,1,1,-1,
Dewa Pindi,1,2021-12-05 2:49:00,MyXL tolong minta perhatiannya sudah dari bulan Juli sampai desember poin saya tidak ad penambahan. Masalahnya saya tetep beli paketnya di myXL.... Untuk masalah ini tolong kejelasannya.,3,3,3,0,
Dezie Widiantoro,5,2021-12-05 23:14:00,"Pada aplikasi ditambahkan menu layanan untuk xlhome, baik pengaduan, pemeliharaan, dan ulasan. Sehingga jika kita ingin melakukan pengaduan atau layanan apapun bisa melalui 1 aplikasi (myXL) tanpa harus melakukan panggilan telefon.",3,3,3,0,
Faruq Donahue,1,2021-12-05 22:14:00,"Pengen perpanjang paket data yg harga 69000, sy isi pulsa, dan dipaksa sy ada 74000, masa tau2 besok nya lenyap tinggal 24.000 yg 50.000 kemana??? Padahal ngak ada riwayat transaksi sama sekali di aplikasi xl nya. Tolong lah balikin pulsa sya",1,1,1,-1,
Aris Fadillah Yuliawan,1,2021-12-05 1:47:00,Saya diberi Kartu Satu XL sbg pelanggan setia xl home 25.000 dapat 15 Gb sebulan. saya sdh menggunakan XL home selama 3 thn. habis ga habis kuota 15 GB akan hangus bulan depan kuotanya.. bulan pertama sisa kuota 11 GB hangus jadi awal bulan kembali 15 GB. bulan kedua sisa 600 MB & parahnya di tgl 1 Des kuota dulu ga hangus dan tdk ditambah .. saya menghubungi Gangguan 820 dan di trima dgn nomer pengaduan C26373.. dijanjikan paling cepat 1 x 24 paling lama 3x24 jam sampai 5x24 ga ditambah parah,3,3,3,0,
Dedi Elwanto,1,2021-12-05 17:54:00,"Tolong setelah update kok makin error saja, terutama saat maen game online sinyal nya error,ping ny pun merah , tlng di perbaiki jaringan nya,jika tidak para pelanggan akan pindah ke operator lain...",3,3,3,0,
Moelyadi,3,2021-12-05 10:20:00,"Aplikasi myXL sangat membantu dalam informasi sisa pulsa serta info kuota paket yg tersisa dan fasilitas lainnya,semoga kedepannya aplikasi myXL banyak program2 Discount,Bonus serta Promo2 yg memberikan kemudah2 dalam pelayanan untuk penguna layanan XL,ini sangat penting dan perlu diingat bahwa XL dapat berkembang dan maju hingga kini karena pelanggan setia penguna XL, jadi utamakan pelanggan dan berikan pelayanan prioritas ke pelanggan jangan melihat Kasta atau Status Sosial Nya.Salam Mulyadi",2,2,2,1,
gilang yusuf gumelar,4,2021-12-05 0:20:00,"Aplikasi ini sangat mambantu saya dengan baikk, namun ada satu hal yang menurut saya kurang yaitu pembayaran via Bank hanya bisa satu bank, jadi tolong tambah lagi pembayaran via banknya ya jangan cuma ke satu bank saja devploper terimkasih",2,2,2,1,
Septiana Mona,1,2021-12-04 0:47:00,"Sudah lama pakai myXL, tapi beberapa hari ini waktu dipakai aplikasinya gak merespon. Setelah diperbarui juga gak ada perubahan, setiap mau transaksi pembelian kuota pasti aplikasinya gak merespon trus langsung keluar sendiri. Sudah di coba beberapa kali juga masih sama. Mohon diperbaiki.",3,3,3,0,
Nounna Tv,3,2021-12-03 6:51:00,"Selalu ada tulisan maaf my xl tidak menanggapi, akhirnya terpaksa saya keluar, dan itu bagaimana tanggapan dari developer perusahaan xl, kenapa tidak konsisten dengan masalah masalah seperti ini, sekecil apapun masalahnya, bisa berdampak buruk bagi pengguna, ingat itu. Dan satu lagi, saya punya bonus scan tapi tidak bisa di pake, udah 2x beli voucer, semua bonus scan tidak bisa di aktifkan,",1,1,1,-1,
Salsabila Zahratul,1,2021-12-03 5:31:00,"halo, ini kenapa gabisa dibuka app xl nya?? udah minta bantuan tanggepan nya lelet bgt, nunggu kepotong trus pulsa nya, ada apasi sma xl? bales ulasan make link bukan nya bales sesuai kritikan, gimna si ini hadeuh cape bgt, update aja trus tapi gaada feedback ke pengguna!",1,1,1,-1,
silvia eva,1,2021-12-03 4:51:00,"Payahhhhh bangeeetttttt Setiap mau beli paket tulisanya terjadi kesalahan terus, mana beli paketnya harus lewat aplikasi lagi, mending klo app nya normal ini app nya bobrok bgt!!!!!!!",1,1,1,-1,
Blegedes Team,1,2021-12-03 4:39:00,"Ini sih bukan perbaikan.. Malah semakin BURUK.... BANYAK YG GA KEBUKANYA. apakah sudah Diuji terlebih dulu sblm di sebarkan? Dan anehnya jaringan internet sekarang2 hampir sama dengan provider simerah sinyal full tp internet off, apakah jaringan pesaing berat XL ini 1 tower, saling numpang pemancar gitu..? Penyakitnya bisa sama gini.. Saya aktifin kuota XL dan Simerah, dua2nya penyakitnya sama, saingan harus menyamai yaaahh ðŸ¤”ðŸ¤”",1,1,1,-1,
ARGaming,2,2021-12-03 4:39:00,makin lama kq makin gak jelas gini seh jaringan nya? buat masuk aplikasi My XL aja gak bisa! tolong lah diperkuat lagi jaringan nya meskipun hujan badai ttp stay gitu. saya pengguna lama loh dikartu XL ini.,3,3,3,0,
Daffario Raissadewa,1,2021-12-03 4:09:00,"Aplikasi apa ini setelah update/sebelum update masa saya gak bisa cek kouta padahal masih banyak pulsanya.Dan juga di aplikasi ada tulisan ""GAGAL MEMUAT DATA COBA LAGI"" Kenapa ini tolong di jawabðŸ˜¡",1,1,1,-1,
Anis Sitiaisyah,1,2021-12-03 4:06:00,Seharusnya saya baca dulu ulasan yang lain. Saya dapat bonus xtra kuota yg harus diklaim dari aplikasi myXL ini. Saya mau klaim 30 menit setelah isi pulsa. Tapi yg terjadi hanyalah HARAPAN PALSU. BONUS TIDAK BISA DI KLAIM SELALU MUNCUL NOTIF KESALAHAN SAAT MAU KONFIRMASI. Saya pikir dgn laporan kinerja baik XL awal tahun menjadikannya lbh baik tapi kenyataannya malah membuat PERUSAHAAN INI SEMAKIN TULI KRITIK !!,1,1,1,-1,
Harris maryanto andriansyah,1,2021-12-03 4:05:00,"sistim bokbrok sekali , sebelum di update bagus'' ajah bisa masuk apk , kenapa setelah versi teranyar malah gak ada kuotaðŸ˜‚ jelas'' kuota banyak ttep ngotot maaf kuota anda habis ,gila memang AUTO HAPUSSS GAK GUNAA BGSD!!!!!!!",1,1,1,-1,
robert budianto,5,2021-12-03 4:01:00,"XL sudah bagus jaringannya dan bisa dipakai di seluruh pelosok daerah , center call nya ramah dan dijawab dengan jelas dan mudah dimengerti , Security buka account nya sangat teliti ,dan produk XL terus update dan masih menunggu 5G .",2,2,2,1,
sad boy,1,2021-12-03 3:37:00,"Kenapa ngambil bonus kuota harus lewat apk my XL, Bayangin lu isi pulsa trus dapet bonus,ngambil nya di my XL otomatis kan lu aktifin data, dan lu tau kan apa yg terjadi,,,,,,,, yap,, pulsa anda terpotong,,, gak jadi beli kuota, ,,,, kan sesat sekali",1,1,1,-1,
Danang Yoga,1,2021-12-03 2:23:00,Meski sinyal bagus tetapi pemotongan pulsa yang terus berjalan meski tidak menggunakan layanan internet menjadi satu hal yang sangat merugikan customer XL. Belum tau kedepannya apakah masih menggunakan operator XL apa tidak. karena operator lain tidak akan memotong pulsa ketika saya menggunakan XL untuk berinternet.,3,3,3,0,
zulfan Achmad Rifani,1,2021-12-03 17:13:00,"Buat main game lemot gabisa masuk dalam permainan FF aku menggunakan xl unlimited, buruksekali baru kali ini bawa game ff gabisa masuk lobby pake jaringan kentang !!!!!!!!!!",1,1,1,-1,
Hadi Mustamin,5,2021-12-03 15:47:00,Allhamdulillah ada perubahan tolong dikembangkan dalam mengolah jaringan...! Segala bentuk ucapan terkadang menyakiti perasaan orang tanpa kita sadari tapi dikala penyesalan itu datang persaan jdi sedu sedan ingin rasanya menghukum diri sendiri dari apa yg kita ucapkan tadi.Maaf beribu maaf dik Maya...,2,2,2,1,
vicky sutandi,1,2021-12-03 15:35:00,"Ini kenapa sudah 2 Minggu signal xl gk bagus,, susah jadi buat mobile,, Bikin orang jadi susah buat keperluan sehari-hari,, Harus ganti kartu seperti nya XL susah sangat buruk",1,1,1,-1,
leni nursela,1,2021-12-03 15:27:00,"tolong dong kuota malam nya jgn banyakÂ² lahh, hrusnya ditaruh di 24 jam semua jaringan aja, soalnya buat sekolah dll... sayang kuota malam nya lah masih bnyk bgt tpi g ke pakai, lgian sapa yg mau pakai? mungkin hny sebagian org saja yg pakai, wktu tidur masa suruh bangun tengah mlm ?mohon kebijakannya.",3,3,3,0,
Marlaba Torus,5,2021-12-03 15:25:00,"Saya pelanggan XL setia, Kasih Bonus yang banyak dongðŸ˜ðŸ˜. sayati-ganti nomor karena hilang sama hpnya. kalau bisa, apakah pihak xl bisa melacak keberadaan hp saya?. Terimakasih ðŸ™ðŸ™ðŸ™",3,3,3,0,
Reza Gaming 23,2,2021-12-03 12:59:00,"Di solo jawa tengah xl sering terjadi gangguan terkadang sinyal gak muncul sama sekali,kuota xl masih banyak pulsa juga ada. Dimohon dari pihak xl segera memperbaiki jaringan dikarena mengganggu aktivitas kerjaan",3,3,3,0,
