Oky Arwanto,1,2022-01-06 17:12:00,Apa gunanya ada program swadaya untuk MITRA DRIVER GOJEK. namun tidak bisa di akses.. sejak desember halaman tidak bisa di akses bahkan dr aplikasi My XL pilihan paket tidak tampil zonk. Saya pelanggan XL dari 2007 sampai sekarang tapi tidak ada bonus atau reward apapun yang saya dapat melainkan RASA KECEWA ðŸ˜ ðŸ˜ ðŸ˜,1,1,1,-1,
Fajar Siregar,5,2022-01-06 11:07:00,"Untuk update saat ini cukup lumayan bagus,tetapi pada fitur *KONTROL PULSA* tetap di tingkatkan lagi fiturnya. Dan di fitur Live Chat Asisten Virtual Maya sudah lumayan bagus,tapi ketika mengakses nya sedikit ada ""lagging"" Juga pada fitur cek area/device VoLTE/4G sedikit mengalami nge - ""Freez"" disaat itu juga mengalami sedikit peningkatan suhu pada device.",2,2,2,1,
Kura Kelantang,3,2022-01-05 8:30:00,"Lumayan suka saya selama makai krtu XL AXiata cukup membantu. Tetapi jaringan sering hilang mohon jaringanx di tingkatkan lagi,,,,saya kasih â­3 dlu nanti makin bagus jaringanx saya tmbah â­ lgi..... Terima kasih",2,2,2,1,
Nanang Hermawan,1,2022-01-05 6:01:00,Sinyal XL sungguh hancur di daerah Gresik kecamatan Benjeng. Kadang sudah 4G+ buat main game tibaÂ² jadi H. Alhasil main game online jadi amburadul. Kalah terus garaÂ² sinyal yg hancur. Tolong di perbaiki kalau gak mau kalah sama yg lain. Kalau gini terus nomer XL saya hanguskan biar jera.,1,1,1,-1,
Mbah Nyumput,4,2022-01-05 2:19:00,"Apk.bagus. tp sinyal jlk banget hari ini. Dari pagi E terus. Apalagi klo hujan. Sy skrg d jln Baturaja jakpus. Sering d bully sm rekan krj krn pke XL. ini bukan nyinyir y,tp masukan utk XL. Krn sy ttp pke XL.",2,2,2,1,
Umar Yono,2,2022-01-05 15:39:00,Pengen beli paket data kok kosong.... udah update 2x sampe hapus data.... tetep aja NIHIL.... Mana my XL ?????? Jaringan buat sy dah lumayan ...tapi kaga bisa beli paket....,1,1,1,-1,
Edi supriadi Supri,1,2022-01-05 13:25:00,"Ini apa apl nya apa sinyalnya sih !!? Pas di buka malah ada tulisan ""Coba lagi coba lagi coba lagi"" trus aja gitu...kayanya dua duanya dech !!",3,3,3,0,
Nur Rohman,1,2022-01-05 11:34:00,"Saya pengguna kartu perdana xl yang cukup lama sangat kecewa, Setiap kali isi pulsa selalu terpotong 1000/harinya padahal tidak di gunakan sama sekali dan anehnya setiap hari ada sms ""(Anda sedang menikmati internet dengan tarif normal Rp1rb/MB. Mau YOUTUBE tanpa kuota? Pilih Pkt XTRA Combo di *123#"") padahal jaringan seluler menggunakan perdana yang lain Dan kejadian ini bukan saya saja yang mengalaminya.",1,1,1,-1,
Muhammad Zakwan,1,2022-01-05 0:27:00,"Awal tahun sampe tanggal sekarang jaringan jelek banget, buat lu yang blm pake xl mending jangan dah, xl lagi ancur-ancurnya gak ada perbaikan sinyal, nonton yutub 144 aja ngeleg terus, kebayangkan lu mau chatingan kayak apa, xl cacad.",1,1,1,-1,
Jeje Lynn,1,2022-01-04 7:53:00,Mohon di infokan... Saya daftar untuk tambah kuota... Kuota lama saya malah hilang... Pdhl kuota lama saya masih banyak... Biasanya nggak apa apa ... Tolong kembalikan kuota saya!!!,1,1,1,-1,
abdurrahman tralala,1,2022-01-04 23:23:00,"Mohon maaf pak, kenapa pas kena update malah sering gagal loding,mau bagi paket malah dirusuh bikin pin pas udah mau bikin pin eeee malah erorr, trus kode verifikasi datang pas sya keluar dri app, kan ini bencana adik adik",1,1,1,-1,
arsan puput,4,2022-01-04 17:59:00,aplikasinya bagus top lah buat XL................. ........................................................................................................................................................................................................................................................................................................................kenapa aku kasih bintang 4 soal nya masih ada yg kurang baik ya itu sering keluar dengan sendirinya tolong di perbaiki lagi aplikasinya,2,2,2,1,
Agung Heru GS,1,2022-01-04 13:52:00,"Hati-hati xl,jika terlalu sering bermasalah jaringan internetnya maka pelangganpun akan semakin cepat meninggalkanmu. Dan beralih ke provider yang merah. (Sekarang bintang saya naikan menjadi 5,karena sudah lebih baik lagi)",1,1,1,-1,
Hesty Togatorop,1,2022-01-03 9:10:00,"Sinyal sangat buruk, kuota banyak sering tidak habis, hanya krn sinyal bisa mati berjam2 dan itu berulang tiap harinya. Bar sinyal ada, tpi tidak bisa konek ke jaringam internet. Seperti hanya utk pajangan saja. Uda hubungi ""Maya"", tp ga ada perubahan. Sangat mengecewakan.",1,1,1,-1,
gustiliant,2,2022-01-03 8:03:00,"pihak xl tolong konfirmasinya ya ,saya beli unlimited premium harga 50.000 untuk sebulan, tapi kenapa cuma bisa sampai 7 hari aja, tolong tanggung jawabnya ini bukan pertama kalinya ya",3,3,3,0,
Hen Wjy,3,2022-01-03 4:31:00,"Untuk live chatnya mohon diperbaiki, pelayanannya tolong dipercepat. Kasihan yang sudah lama menunggu antrian tetapi saat sudah mendapatkan giliran malah pelayanannya lelet. Terima kasih",1,1,1,-1,
Syariyani Ardhy,3,2022-01-03 2:09:00,Aplk nya berat...klo di buka lama banget muter nya.... Klo promo2 nya aq suka...terus tingkat kan dan di tambah trs promo2 nya....signal nya juga bagus di daerah ku..,3,3,3,0,
bulan VIP,1,2022-01-03 21:56:00,"Apakah terjadi ke saya aja atau pengguna lain? Mau masuk myxl g bisa, gmn ngeklaim unlimited. Beli paketan klo masuk app aja gak bisa.. sampe detik ini gak bisa. Udh berminggu2.",1,1,1,-1,
rendy airlangga,3,2022-01-03 16:59:00,terkadang aplikasinya masih suka susah untuk di buka...dan juga update sisa kuota paketnya selalu suka berubah-ubah.....walaupun cukup membantu...lebih ditingkatkan lagi saja aplikasi nya min....agar pelanggan juga puas dengan mendownload aplikasi ini....,3,3,3,0,
wiratama channel,2,2022-01-03 15:02:00,"Saya kurangin lgi bintangnya, Jujur pembagian kuota youtube buat apa? Kalau setiap buka youtube yang kesedot malah kuota utama, setelah kuota utama habis nggak bisa buka youtube padahal paketan kuota youtube masih utuh,, pemodohan kalo bgni caranyaðŸ˜” Tolong kenyamanan dan kepercayaan pelanggan di prioritaskan, makasih",1,1,1,-1,
Dwiky,1,2022-01-03 14:40:00,"Sebenernya udah bagus dulu, tapi sekarang kok malah bikin stres sih sinyal lah gangguan lah udah direstart berulangkali loh masih aja, punya kuota juga masih banyak. Kasih solusi dong buat daring nya itu loh susah",1,1,1,-1,
amanda afa,1,2022-01-03 14:39:00,"Kuota masih 12 GB, unlimited juga nyala! Tapi kenapa buat buka aplikasi xL saja eror? Buka youtube juga muter terus?? Sudah berulang kali matiin data matiin daya, berulang kali tetap sama ? Kuota tidak bisa di pakai??",1,1,1,-1,
Veny Ananda,1,2022-01-03 14:39:00,Belakangan ini sinyalnya kek taik !!! Gw dari kartu 3(tri) gw bela2in pindah xl !! Jangan sampe ini berkelanjutan yaa !!! Tolong secepatnya jangan gampang trouble sinyalnya !!! Kalo mendung hujan gw maklumin ! Lah ini cerah bet masak trouble mulu !!! ðŸ˜•ðŸ¤¨,1,1,1,-1,
Joko Ae,2,2022-01-03 13:39:00,"Tolong kalau punya aplikasi yg bener dong perbaikan updatenya, masa buka my XL masukin akun baru selalu alesan ""koneksi bermasalah"" sekalinya nonton yt dll, lancar jaya. Buat apa tiap minggu ada update kalau hasilnya kayak gitu.. GEBLEKK",1,1,1,-1,
Rizka Aditiya,1,2022-01-03 13:18:00,Woi Provider Sampah Tolol. Kuota masih kok internet nggak jalan Asu. Dipake main game kek siput jumping mulu. Provider sampah asu kek gini bisa jadi provider terlaris ke-2 lawak konyol.,1,1,1,-1,
Boss_Oman,3,2022-01-03 13:16:00,"Permisi, kenapa sekarang jaringan sering eror? Padahal sinyal penuh 4G tapi pas buka game yang pake kuota tidak bisa muter"" terus. Tolong diperbaiki lagi masalahnya sebelum saya ganti kartu yang lebih baik terimakasih.",1,1,1,-1,
Ridwan Maulana,1,2022-01-02 9:52:00,"Parah banget njirr XL, gw isi pulsa yang 20k,gk aktifin data pulsa gw ke ambil mana ke ambilnya 12k lagi, tinggal sisa 8k lagi, padahal gw mau beli paket game ML yang 10k,eh pas gw ngisi pulsa lagi yang 5k malah paket game ML yang 10k 10gb malah gk ada males banget gw,terpaksa dah gw beli yang 9k 3gb dan itupun cuma 7 hari,padahalkan dulu 10k 10gb 1 bulan, sumpah gw nyesel banget ama XL sekarang!",1,1,1,-1,
Sinar Cell,1,2022-01-02 9:31:00,"Saya beri 1 bintang karena kenapa pulsa saya dikuras sama operator padahal saya tidak menggunakan kartu itu dan saat saya beli paket,paketnya tidak masuk tapi pulsanya yg dikuras, saya mohon agar APK di peebaiki",1,1,1,-1,
Ganyong Clavers,2,2022-01-02 8:32:00,Saya kecewa kemarin saya top up paket data menggunakan voucher extra combo lita. Padahal kemarin udah ada notif berhasil. Eh sekarang malah hilang. Akhirnya saya beli lagi.,1,1,1,-1,
muhammad fahrul ulum,1,2022-01-02 7:17:00,Pkt Xtra UNLIMITED TURBO Premium Rp50rb Anda sudah berakhir. Cek pilihan paket menarik lainnya di aplikasi myXL. Info 817. padahal baru aja di isi lah kog Malahan ada pesan gini?,3,3,3,0,
Eri Kristanto,4,2022-01-02 5:05:00,"Penting untuk punya aplikasi operator untuk menunjang kemudahan pengecekan pulsa, kuota, masa aktif, promo dst. XL punya my XL untuk itu semua. Satu hal yang mendasar bagi saya, myXL belum punya fitur pengunci pulsa seperti yang dimiliki myAXIS yang notabene masih anak dari XL. Pengunci pulsa penting bagi saya karena dapat menghindari pulsa kita berkurang otomatis tanpa kita minta karena termakan data internet, promo memakai pulsa dan hal lainnya. Semoga myXL segera menyusul ini.",3,3,3,0,
Novi Alfiani,1,2022-01-02 17:14:00,Setelah di update untuk masuk kembalinya susah.. Terutama untuk anak kost yang tempat kost 2lantai 3 lantai dll.. Kita di (lantai dasar) Kehalang beton lantai langsung tidak ada signal sama sekali!! Aduuh xl aku dibuat kapok langanan bulanan ðŸ˜•,1,1,1,-1,
Khairun Nisa,1,2022-01-02 15:52:00,"Sekarang ini jaringan xl luar biasa lelet banget beli paket 10gb buka SW aja loadingnya lama banget, kaya pake gratisan tp kuota nya tetap boros 4 hari habis tu 10gb. Kenapa ya???",1,1,1,-1,
Aditya Kurniawan,1,2022-01-02 14:00:00,"HAK PENGGUNA HILANG!!! jaringan bapuk, salah siapa ini???? bukan cuma 1 kota, hampir smua kota keluhannya sama! Jangan yg pasca bayar aja donk, kalian tanpa kaum2 pra bayar bisa apa",1,1,1,-1,
Rino Setiawan,1,2022-01-02 0:23:00,"Kenapa xl sekarang jaringannya lemot, ini saya kemaren pas thn baru udh 3 hari gada sinyal, udh saya coba segala cara biar dapet sinyal tapi gada hasil, tolong ya xl",1,1,1,-1,
Manatu Atu Online Shop,4,2022-01-01 9:27:00,"myXL sekarang udah keren... Ada pengaturan dari pemotongan pulsa krn data dan sms berbayar. Penggantian kartu hangus juga lewat app (walo blm coba sih). Tapi after all keren, ditunggu inovasi barunya lagi ya.",2,2,2,1,
DeDrakor Tube,4,2022-01-01 7:04:00,Saya tambah bintang 1....untuk saat ini pelayanan sinyal dan keamanan sudah cukup baik..tetapi bisa tidak ya kuota utama itu jangan ada kuota malamnya. Sebab tidak terpakai kalau malam2..yang ada ngantuk,2,2,2,1,
Super Shoot,1,2022-01-01 21:15:00,"Makin gk jelas pembagian kuota nya!! ðŸ˜ˆ..gua padahal ada kuota unlimited akses youtube...eh, malah ke sedot kuota utama gua pas lagi streaming youtube..trus.. fungsi kuota akses Unlimited youtube nya apa??!!!!! Kalo kuota utama nya juga ke sedot??!",1,1,1,-1,
Yuda Ades,2,2022-01-01 1:03:00,"Jaringan ga stabil, tiap hari jumat sampai hari minggu jaringanya muncul cuman 6 jam, terhambat semua pekerjaan. Xl kalau mau bersaing dengan operator lain ya jaringan harus diperbaiki dulu, bukan fitur aplikasi my xl-nya.",1,1,1,-1,
Smile So good,1,2022-01-01 15:58:00,"Kesel bgt gw sama xl.. Klo gw beli paketan yg semingguan, sinyal internet lancar, giliran gw beli yg 150giga, sinyal kaya kentut..!! Mubaziir..!! Udah bikin laporan sampe 2x ga ada perubahan.. Klo ada bintang minus, bakal gw kasih tu bintang..",1,1,1,-1,
Khatib Nur Garus,1,2022-01-01 13:25:00,"Gak berguna , asal hujan jaringan untuk beberapa hari kedepan selalu terganggu , jujur beda bener sama TELKOMSEL . Telkomsel wlwpun cuaca hujan paling lama gangguan sinyal hanya beberapa jam paling lama , jika XL sampai beberapa hari , mau TF dan lainnya susah bener internet . Gak coba2 lagi pakai XL , MENYESAL SAYA PAKAI XL !! .",1,1,1,-1,
Choirul Mukminin,2,2021-12-31 17:16:00,"mohon maaf sebelumny. ini saya beli voucher dan dpet bonus kuota 1gb tiktok,youtube,atopun instagram. tetapi waktu saya pilih tiktok/instagram, kenapa error mulu? sedangkan waktu milih yt malah lancar jaya. apakah ini teknik marketing?",3,3,3,0,
faridatul khusna,2,2021-12-30 8:15:00,Ini kenapa ya? Pdhl baru diupdate tapi 2 minggu kemudian minta diupdate lagi. Kalo engga diupdate engg bisa dipakai apk nya. Terimakasih By: Kidor,3,3,3,0,
Dandi Dito,1,2021-12-30 7:32:00,Aplikasi terus update sinyal makin lemot saya pengguna XL dari tahun 2015 dan sejak 2019 XL lebih mementingkan update aplikasi dan paket data sedangkan jaringan bukan nya makin kenceng malah makin lemot bahkan sekarang jika di bandingkan dengan smarfren lebih kenceng smarfren di bandingkan XL yang paket kuota semakin mahal tapi sinyal semakin turun jujur saya kecewa saya jadi tindak nyaman main game menggunakan kartu XL jika terus seperti ini saya akan berhenti berlangganan .,1,1,1,-1,
Tyaga Dahayu,1,2021-12-30 4:05:00,"Paket yg ditawarkan banyak jebakannya, hati hati. Kalau ada penawaran paket murah hati hati. Cukup beli 1 kali saja, soalnya terakumulasi maks 1gb",1,1,1,-1,
Sun Delivery,2,2021-12-30 11:41:00,ketika membeli paket yg sama utk memperpanjang kenapa sisa paket yg terdahulu dihabiskan dulu baru kuota yg baru ini aplikasi myXL yg agak error ato gmn ya ada yg bs bantu jelaskan???,3,3,3,0,
So Sweat,5,2021-12-29 8:49:00,"Hallo kk,,,saya telah melakukan isi ulang pulsa 20k,, dan membeli paket 9GB 7 hari di aplksi ini,,,kenapa kuota saya tidak dapat di gunakan??!!",3,3,3,0,
Ferdy Medjaya,1,2021-12-29 8:26:00,Ini XL lagi kenapa yaaaaaa??? Saya mau transfer pulsa/paketan ke anak saya di jakarta malah eror teruuussssss padahal masa aktif masih lamaaaa!!! Mohon di perbaiki secepatnyaaaaa!!!,3,3,3,0,
Muhammad Rafli,1,2021-12-29 6:11:00,"Pelayanan buruk, live chat juga tidak dapat memberikan solusi terkait masalah yang dihadapi oleh konsumen, saya tidak bisa mengaktivasi paket dan disuruh registrasi ulang, tetapi saya selalu gagal dalam melakukan registrasi ulang. Memang operator sampah, lama lama pindah juga saya ke operator lain",1,1,1,-1,
Dhita Jaya,4,2021-12-29 6:04:00,"Untuk aplikasi, sangat memuaskan karena sering memberi diskon kuota; sehingga pengeluaran jadi lebih hemat. Untuk sinyal ... cukup tau aja kadang bikin emosi :)",2,2,2,1,
F. Wullan,2,2021-12-29 3:52:00,"XL ayo lah sinyal ku ni knapa lagi:( cape lah aku nii tiap mau maen game lag mulu, kirim HP ku ternyata jaringanya, kirim game nya ternyata jaringannya, uda 4g terus jadi H doang :( keburu ganti kartu lain ni ya:) ku mohon :) plisss ya ya beneran ni lah sumpah gk boong:) udah 3/ 4hnan aku pakek XL ni, dulu"" Gk gini ayo lahhhh:)",1,1,1,-1,
Agasha Boen,1,2021-12-29 3:39:00,"Uh...Halo kak,saya ingin mempertanyakan sesuatu.Saya memiliki utang 16.500 dan saya membeli pulsa 50 Tetapi pulsa saya tidak terpotong,biasa nya terpotong karena tagihan pulsa ini tidak.Apakah ada kesalahan? Saya cek penggunaan pinjaman pulsa masih ada tagihan nya.",3,3,3,0,
Herman Satya adi,1,2021-12-29 20:41:00,"Apk keluar sendiri mulu ga ada respawn mulu kaga jelas . mau beli paket lewat apk malah gabisa no respawn terus ujung ujung nya nyedot pulsa , paket kaga ke beli pulsa abis !!!",1,1,1,-1,
Edo Pratama,1,2021-12-29 15:46:00,"Xl makin lama bukan nya makin bagus malah makin buruk, gk sesuai sama selogannya.. Tolong lah dengar kami sebagai pemakai xl.. Masa kalah saing sama tsel.. Ini klo bkn karna di kantor cuma bisa jaringan xl.. Udh saya buang ni kartu xl..",1,1,1,-1,
Dedi Mulyawan,1,2021-12-29 13:50:00,"Live chat kaga guna, kaya ngomong sama robot....isi paketan dari siang blm juga masuk....pelayanan buruk, signal juga parah....kecewa.!!!!",1,1,1,-1,
DERI ADRIAN,1,2021-12-29 12:43:00,"Lu kalau gk niat ngasih discon mending gk usah deh,Gw cek ada discon 70 gb 48 rb,trus gw isi pulsa 50 buat maketin,dah gw paketin malah dapet sms ""Pelanggan Setia XL,terjadi kesalahan saat aktivasi"" trus gw cek lagi tau tau promo nya dah ilang,jadi normal 239 rebu,parah parah,tau gini gw gk bakal ngisi pulsa",1,1,1,-1,
Wibowo Trisno,1,2021-12-29 12:16:00,"Kartu bisa tiba-tiba blank sinyalnya. Gimana ceritanya. Lagi di pakai tiba-tiba hilang ga tau kenapa. Masa aktif masih panjang, paketan baru kepakai 20 am hari, malah blank sinyalnya. SANGAT-SANGAT TIDAK REKOMENDASI. YAAAA BUAT MAIN GAME JANGAN HARAP LANCAR. YAAAA",1,1,1,-1,
Bang JO,2,2021-12-29 11:34:00,Kenapa saya tidak bs membeli Kuota unlimited Extra Combo VIP plus ... Setiap klik Beli paket Tulisanya selalu tidak ada pilihan paket untuk anda. Saya coba update aplikasinya jg ttep sama. Gmn solusinya,1,1,1,-1,
Marudut Gunawan,1,2021-12-29 11:28:00,Parah makin parah sekarang jaringan hilang hilang terus sering dapet sinyal E ....saya lagi butuh banget jaringan buat komunikasi ehh malah sinyal jelek terus...kecewa sangat kecewa...pihak xl hanya bisa minta maaf wkwkwkwk kata maaf tidak bisa menyelesaikan masalah boss...mending pindah ke Tsel dah kalo kyak gini terus,1,1,1,-1,
bambang hermawan,1,2021-12-28 7:39:00,"Ga lagi2 dah langganan paket promonya dari aplikasi, harga seh murah tapi jaringan parah banget. Paket yang normal pun jaringan ga se kenceng provider tiga. Fix cukup buat telpon saja.",1,1,1,-1,
Echa Intan,2,2021-12-28 5:57:00,Maaf mau tanya saya buka myXL mau ambil kuota unlimited gratis tapi pas di buka aplikasinya tiba-tiba muncul myXL tidak menanggapi. Kalau kendala kaya gitu gimana? Mohon bantuan nya saya mau ambil kuota unlimited gratis Terima kasih...,3,3,3,0,
Yraisy Mcqueen,2,2021-12-28 3:30:00,"Makin parah aja jaringan nya :( cape protes Mulu, udah sering bgt tlpn. Kalau udah bener, gak lama gtu lagiiiiii gtu lagiiiii, tlpn lagiii ,tlpn lagiii. Skrg udah malas mau protes tlpn juga, makin kacau bgt. Buka aplikasi lain langsung E, bahkan langsung Silang kadang. Pas out dari aplikasi,eh nongol lagi. Mau nya apa coba. Emang ngisi data buat apa kalau bukan buat di pakai?",1,1,1,-1,
Kedai_Coffee_Din,1,2021-12-28 21:14:00,"myXL makin ga jelas Udah berapa kali beli paket internet selalu tidak bisa di pakai/tidak bisa digunakan. Ahirnya uang saya abis cuma buat beli paket internet terus""an. Dan semalem sampe pagi ini,,saya mau beli paket internet VIP tidak bisa terus. Udah sinyalnya parah ngeleg banget. (Tolong diperbaiki dong sinyal sama jaringan nya) Saya pelanggan setia myXL masa kaya gini sih ga ada kemajuanya.",1,1,1,-1,
Mas Opick,3,2021-12-28 1:21:00,"ada penarikan pulsa tanpa adanya persetujuan dari konsumen,yg seharusnya tidak terjadi karna akan merusak citra proveder XL sendiri semisal sms dari nomor 99876 dll terus adanya paket tlp harian yg tanpa adanya persetujuan dari konsumen ini uda sebagian bentuk dari kecurangan kita stop ya gak bisa karna paket harian,pada akhirnya konsumen gak lagi stok pulsa di sim card",1,1,1,-1,
Ahmad Nur Kholis,3,2021-12-28 1:17:00,"Akhir2 ini Jaringan XL jadi kadang ilang sendiri, trus buat ngebuka beberapa aplikasi harus dimode pesawat dulu atau gk bisa masuk sama sekali. Buat masuk aplikasi XL aja gk bisa masuk, jadi kalo tiap cek info harus lewat nomor. Tolong diperbaiki, harga dinaikin ke harga yg sewajarnya gk apa2, masalah jaringan diperbaiki. Tolong ditanggapi, makasih.",3,3,3,0,
Ilham Colo,3,2021-12-28 16:26:00,"Hanya saran ya,,, supaya ada pengaturan paket kuota. kan ada paket combo, hotdrod, mini, game, dll. Kalo kita punya dua paket berbeda bisa ngatur,mana dulu yang mau dipake, jadi paketnya berkurang sesuai keinginan kita, tidak ngurang sesuai tanggal beli. Kalo sesuai tgl beli, kita kan rugi, kalo kita beli paket lagi yg berbeda dari yang pertama, paket yg pertama gk bisa kepakai.",3,3,3,0,
Novia Sitorus,1,2021-12-28 15:50:00,"Permisi... Saya mau nanya kenapa di saat saya mau klik pilih bonus tidak ada respon dan keluar dengan kata aplikasi tidak merespon, saya Download ulang sudah saya lakukan, saya restat hp saya sudah coba, udh bebrpa kali saya coba tetap seperti itu.. Mohon balesan y",3,3,3,0,
Djo Jo,1,2021-12-28 15:19:00,Apk nya tiba tiba terhenti mendadak dan tidak merespon ketika ingin menukarkan point' dan mengklaim bonus kuota jika ingin lebih baik dari jaringan operator lain perbaiki segera agar konsumen puas,3,3,3,0,
Tatang Arhata,4,2021-12-27 8:55:00,"Saya tdk banyak paham tentang PRIORITAS XL, karena info dr sales lewat phone cuma iya..iya..saja, tahunya terasa praktis PRIORITAS XL, kendala sekarang jika mau membayar apa bisa di Alfamart? Tolong bantu iya mas/mbak. Tks.",3,3,3,0,
Ven Reiven,1,2021-12-27 4:37:00,"1-10 nilai keunggulan &kekurangan card XL ,Keunggulan : dari card XL itu,buat download,streming,sosial media enak, nilai 8 ,Kekurangan :dari card XL itu,dibuat maen game jaringan buruk, nilai 2 ,Mending pakek jaringan WIFI stabil ....",3,3,3,0,
Anissa Nur Melinda,3,2021-12-27 2:18:00,"Minta tolong, maya kalo di chat gak usah bertele-tele yaa.. saya bingung mau nyampein keluhan kok bonus kuota aplikasinya nggak masuk, gak bisa di klaim. Tapi si maya gak bisa kasih solusinyaðŸ™ƒ",3,3,3,0,
Ucu Mustoharoh,1,2021-12-27 13:53:00,"sedih...dibuka susah, pdahal jaringan bagus,restart hp sudah berkali-kali... pas buka myxl baru masuk sebentar mau aktifin paket eeh tau-tau sudah keluar lagi lagi lagi dan lagi..ðŸ˜£ sampe capek bolak balik terus ðŸ™ðŸ™",1,1,1,-1,
Azzahra Hanum,2,2021-12-27 13:13:00,"Disitu ada tulisan ambil bonus anda tapi pas saya mau ambil bonusnya ada tulisan 'Oops, terjadi kesalahan dalam proses aktivasi, silahkan tunggu beberapa saat lagi' tapi tetep aja gak bisa, tolong dong XL dibantu",3,3,3,0,
Um Sonhaji,5,2021-12-27 0:19:00,"Terimakasih XL , semenjak saya ke gerai untuk aktifkan 4G signal kencang luar biasa.... Pekerjaan yg membutuhkan koneksi internet jadi gak terhambat..... IS THE BEST pokok nya ....Konsisten dalam pelayanan terus menerus SALAM IMPROVEMENT",2,2,2,1,
Ari Anggara,1,2021-12-26 8:54:00,"penangan internet XL Home selalu lambat, tiap kali internet bermasalah diminta hanya bersabar menunggu berhari2 tanpa ada visit lgsg ke lapangan. skrg aplikasi mlh gak bisa dibuka sama sekali, selalu tiba2 klr. payahh.",1,1,1,-1,
Jengklong City,1,2021-12-26 8:12:00,Kalo buat gamers sangat tidak rekomendasi buat paket.. Yg di berikan xl mllb sama ff.. Jangan ambil yg free karna buat maen game jaringan menghubungkan tiap rank.. Mending ambil yg unlimited YouTube.. Kalo ambil yg free game.. Sangat gak jelas padahal di jaringan full .. Parah,1,1,1,-1,
Noval Selamet,1,2021-12-26 7:30:00,"Sangat mengecewakan , awalnya tidak pake pin ,, sekarang sudah pake pin dan dimana lagi di suruh buat pin ,,, sudah di buat pin nya .. Eh malah gagal mulu , sudah puluhan kali tapi tetep masih gagal . Bikin emosi ðŸ˜‘ . Tolong d perbaiki .",1,1,1,-1,
Pian Ardiansyah,1,2021-12-26 2:11:00,"2x pulsa kepotong (berkurang) sendiri, pertama ada keterangan nya di riwayat transaksi, yg ke 2 hilang tanpa keterangan dg nominal yg ga sedikit (menurut saya) 60k Sangat-sangat kecewa ðŸ‘ŽðŸ‘ŽðŸ‘Ž SAYA SUDAH MENGAKTIFKAN FITUR KONTROL PULSA JAUH SEBELUM PULSA SAYA TERPOTONG",1,1,1,-1,
Catra Cadudasa,3,2021-12-26 23:24:00,"untuk kualitas internet sih bisa di bilang terbaik, cuma sering ada lag 3detik setetiap beberapa saat hal itu sangat mengganggu saya khususnya saat bermain game, dan di SMS ada diskon ketika saya buka *123*4*3# tidak ada diskon sama sekali.",3,3,3,0,
agus yuliandra,1,2021-12-26 22:47:00,Parah ni. Masak aku pake wifi tapi pulsa tetep kesedot. Jelas banget lagi pas mau beli paket masih ada tu pulsanya giliran pas beli gagal terus tapi pulsa ikut raip.. Padahal proses aktivasi pake wifi..,1,1,1,-1,
Nur Hidayati,1,2021-12-26 21:02:00,"Tiap ari update terus, sementara mau menonaktifkan sesuatu eror terus. Kalo kayak gini trus pulsa dibiarin habis dulu baru isi ulang. Dari pada eror mulu....",1,1,1,-1,
Teguh Setyanto,4,2021-12-26 1:53:00,"Kuota masih banyak, tapi seringnya lemot jaringan xl, bikin pusssiiiing...ðŸ™‹ kenapa kuota ndak akumulasi vocher extra kombo lite sisa 4 Gb, ditambah Vocher lagi baru kok 4 Gbnya gak ada? Mohon pencerahan. Trims. Dan masih sama",3,3,3,0,
Lani Novriantho,1,2021-12-26 17:11:00,"Udah paketan XL prioritas harusnya kouta sisa bisa ke akumulasi sama kouta baru, tapi ini malah ke reset semua, gak jelas tau gt mending gak usah pake embel"" kouta xl prioritas anti hangus, kouta gak ada pulsa kepotong stress lu",1,1,1,-1,
koeching oyen,1,2021-12-26 16:46:00,Terlalu sering lelet . Pulsa sering kepotong . Suka suka nenek moyang mu aja Potong pulsa . Ini namanya melanggar hak konsumen untuk menyisihkan pulsa. Mana jaringan nya lelet. XL 'Xlalu Lelet'.,1,1,1,-1,
REFAN 1998,1,2021-12-26 16:39:00,Kenapa sinyal sekarang malah tambah lag dan sering sekali hilang koneksi Apakah PT XL tidak bisa mengurus semua itu Kami kecewa dengan ini saya beli paket mahalÂ² tapi apa sinyal aja jelek gini tolong sekali secepat mungkin di perbaiki terimakasih ðŸ‘Œ *SEMOGA DI BACA KALAU TDK BERARTI SUDAH TAK MAU LAGI MENGURUS SEMUA KOMENTAR KAMI DAN ANDA LALAI DENGAN PERTANGGUNGJAWABAN ANDA*,3,3,3,0,
back To nature,1,2021-12-26 16:28:00,"xl kenceng bgt nyedot paket, jaringan low tapi paket cepet abis... beda bgt sama plat merah... aplikasi juga sering updateÂ² ga ad perubahan... wa juga lama bgt k'send, ga bebas browsing lagi... vendornya juga ga jelas yg manaÂ²... B.4.B.1",1,1,1,-1,
Julian Haloho,1,2021-12-26 16:10:00,Sinyalnya jelek. Buat emosi kalau main game. Pokoknya jaringannya kalau bisa diperbaikin wilayah bagian berastagi. Kalau gk bisa diperbaikin. Jangan lagi dijual kartunya. Buat konsumen kecewa aja. Terima kasih. Salam dari kota berastagi kab: karo,1,1,1,-1,
